{
  "id": "kb-comments",
  "kind": "kb-article",
  "status": "published",
  "visibility": "public",
  "slug": {
    "en": "comments"
  },
  "title": {
    "en": "Comments"
  },
  "content": {
    "en": "### Queue\n\nNew comments go to the Pending tab when pre-moderation is on in the settings.\n\n### Decision\n\nApprove a comment, mark it as spam or delete it."
  },
  "excerpt": {
    "en": "Approving, spam and deleting."
  },
  "metadata": {
    "section": {
      "value": "moderation"
    },
    "order": {
      "value": 1
    }
  },
  "version": 1,
  "created_at": "2026-06-23T09:00:00Z",
  "updated_at": "2026-09-11T09:00:00Z",
  "published_at": "2026-06-23T09:00:00Z"
}
