{
  "id": "post-svelte-5-runes-in-practice",
  "kind": "post",
  "status": "published",
  "visibility": "public",
  "slug": {
    "en": "svelte-5-runes-in-practice"
  },
  "title": {
    "en": "Svelte 5 runes in practice"
  },
  "content": {
    "en": "This is demo text. The main material goes here: paragraphs, lists and notes. You can edit it in the editor, and saving happens in the browser.\n\nThe second paragraph continues the thought and shows how a long text looks in the preview."
  },
  "excerpt": {
    "en": "In short: svelte 5 runes in practice."
  },
  "author_id": "user-alexey-kovalev",
  "terms": [
    {
      "taxonomy": "category",
      "term_id": "term-category-guides"
    },
    {
      "taxonomy": "tag",
      "term_id": "term-tag-svelte"
    }
  ],
  "version": 1,
  "created_at": "2026-09-18T09:00:00Z",
  "updated_at": "2026-09-20T09:00:00Z",
  "published_at": "2026-09-20T09:00:00Z"
}
