{
  "id": "page-about-the-studio",
  "kind": "page",
  "status": "published",
  "visibility": "public",
  "slug": {
    "en": "about-the-studio"
  },
  "title": {
    "en": "About the studio"
  },
  "content": {
    "en": "This is demo text. The main material goes here: paragraphs, lists and notes. You can edit it in the editor, and saving happens in the browser.\n\nThe second paragraph continues the thought and shows how a long text looks in the preview."
  },
  "excerpt": {
    "en": "In short: about the studio."
  },
  "author_id": "user-maria-sokolova",
  "version": 1,
  "created_at": "2026-08-25T09:00:00Z",
  "updated_at": "2026-08-27T09:00:00Z",
  "published_at": "2026-08-27T09:00:00Z"
}
