{
  "id": "user-smarty-cab",
  "kind": "user",
  "status": "published",
  "visibility": "private",
  "slug": {
    "en": "smarty-cab"
  },
  "title": {
    "en": "Smarty Cab"
  },
  "metadata": {
    "email": {
      "value": "owner@studio.example"
    },
    "role": {
      "value": "admin"
    },
    "avatar": {
      "value": "/img/avatar-john.jpg"
    }
  },
  "locales": {
    "en": {
      "data": {
        "bio": "Site owner."
      },
      "status": "published",
      "updated_at": "2026-03-15T09:00:00Z"
    }
  },
  "version": 1,
  "created_at": "2026-03-15T09:00:00Z",
  "updated_at": "2026-03-15T09:00:00Z",
  "published_at": "2026-03-15T09:00:00Z"
}
