{
  "id": "post-how-we-build-a-design-system-from-atoms",
  "kind": "post",
  "status": "published",
  "visibility": "public",
  "slug": {
    "en": "how-we-build-a-design-system-from-atoms"
  },
  "title": {
    "en": "How we build a design system from atoms"
  },
  "content": {
    "en": "This is demo text. The main material goes here: paragraphs, lists and notes. You can edit it in the editor, and saving happens in the browser.\n\nThe second paragraph continues the thought and shows how a long text looks in the preview."
  },
  "excerpt": {
    "en": "In short: how we build a design system from atoms."
  },
  "author_id": "user-dmitry-petrov",
  "terms": [
    {
      "taxonomy": "category",
      "term_id": "term-category-guides"
    },
    {
      "taxonomy": "tag",
      "term_id": "term-tag-design"
    },
    {
      "taxonomy": "tag",
      "term_id": "term-tag-svelte"
    }
  ],
  "version": 1,
  "created_at": "2026-09-27T09:00:00Z",
  "updated_at": "2026-09-29T09:00:00Z",
  "published_at": "2026-09-29T09:00:00Z"
}
