{
  "id": "comment-igor",
  "kind": "comment",
  "status": "published",
  "visibility": "public",
  "slug": {
    "en": "comment-igor"
  },
  "title": {
    "en": "Igor"
  },
  "content": {
    "en": "Runes really simplify the code. Waiting for the article about effects."
  },
  "metadata": {
    "author_name": {
      "value": "Igor"
    },
    "author_email": {
      "value": "igor@mail.example"
    },
    "moderation": {
      "value": "approved"
    },
    "comment_post": {
      "value": "post-svelte-5-runes-in-practice"
    }
  },
  "version": 1,
  "created_at": "2026-09-29T09:00:00Z",
  "updated_at": "2026-09-29T09:00:00Z",
  "published_at": "2026-09-29T09:00:00Z"
}
