{
  "id": "term-category-cases",
  "kind": "term",
  "status": "published",
  "visibility": "public",
  "slug": {
    "en": "cases"
  },
  "title": {
    "en": "Case studies"
  },
  "metadata": {
    "taxonomy": {
      "value": "category"
    }
  },
  "version": 1,
  "created_at": "2026-06-23T09:00:00Z",
  "updated_at": "2026-06-23T09:00:00Z",
  "published_at": "2026-06-23T09:00:00Z"
}
