{
  "id": "post-how-to-write-interface-text",
  "kind": "post",
  "status": "published",
  "visibility": "public",
  "slug": {
    "en": "how-to-write-interface-text"
  },
  "title": {
    "en": "How to write interface text"
  },
  "content": {
    "en": "This is demo text. The main material goes here: paragraphs, lists and notes. You can edit it in the editor, and saving happens in the browser.\n\nThe second paragraph continues the thought and shows how a long text looks in the preview."
  },
  "excerpt": {
    "en": "In short: how to write interface text."
  },
  "author_id": "user-dmitry-petrov",
  "terms": [
    {
      "taxonomy": "category",
      "term_id": "term-category-guides"
    },
    {
      "taxonomy": "tag",
      "term_id": "term-tag-design"
    }
  ],
  "version": 1,
  "created_at": "2026-09-03T09:00:00Z",
  "updated_at": "2026-09-05T09:00:00Z",
  "published_at": "2026-09-05T09:00:00Z"
}
