{
  "id": "user-pavel-novikov",
  "kind": "user",
  "status": "published",
  "visibility": "private",
  "slug": {
    "en": "pavel-novikov"
  },
  "title": {
    "en": "Pavel Novikov"
  },
  "metadata": {
    "email": {
      "value": "pavel@mail.example"
    },
    "role": {
      "value": "subscriber"
    }
  },
  "version": 1,
  "created_at": "2026-09-26T09:00:00Z",
  "updated_at": "2026-09-26T09:00:00Z",
  "published_at": "2026-09-26T09:00:00Z"
}
