{
  "id": "comment-elena",
  "kind": "comment",
  "status": "published",
  "visibility": "public",
  "slug": {
    "en": "comment-elena"
  },
  "title": {
    "en": "Elena"
  },
  "content": {
    "en": "Can you tell more about the timeline and the price?"
  },
  "metadata": {
    "author_name": {
      "value": "Elena"
    },
    "author_email": {
      "value": "elena@mail.example"
    },
    "moderation": {
      "value": "pending"
    },
    "comment_post": {
      "value": "post-case-study-a-coffee-shop-website-in-two-days"
    }
  },
  "version": 1,
  "created_at": "2026-09-30T03:00:00Z",
  "updated_at": "2026-09-30T03:00:00Z",
  "published_at": "2026-09-30T03:00:00Z"
}
