{
  "id": "media-brandbook-2026-pdf",
  "kind": "media",
  "status": "published",
  "visibility": "public",
  "slug": {
    "en": "brandbook-2026-pdf"
  },
  "title": {
    "en": "brandbook-2026.pdf"
  },
  "metadata": {
    "media_kind": {
      "value": "document"
    },
    "size": {
      "value": 6400000
    }
  },
  "version": 1,
  "created_at": "2026-09-09T09:00:00Z",
  "updated_at": "2026-09-09T09:00:00Z",
  "published_at": "2026-09-09T09:00:00Z"
}
