{
  "id": "page-home",
  "kind": "page",
  "status": "published",
  "visibility": "public",
  "slug": {
    "en": "home"
  },
  "title": {
    "en": "Home"
  },
  "content": {
    "en": "This is demo text. The main material goes here: paragraphs, lists and notes. You can edit it in the editor, and saving happens in the browser.\n\nThe second paragraph continues the thought and shows how a long text looks in the preview."
  },
  "excerpt": {
    "en": "In short: home."
  },
  "author_id": "user-smarty-cab",
  "version": 1,
  "created_at": "2026-08-20T09:00:00Z",
  "updated_at": "2026-08-22T09:00:00Z",
  "published_at": "2026-08-22T09:00:00Z"
}
