{
  "id": "media-price-list-pdf",
  "kind": "media",
  "status": "published",
  "visibility": "public",
  "slug": {
    "en": "price-list-pdf"
  },
  "title": {
    "en": "price-list.pdf"
  },
  "metadata": {
    "media_kind": {
      "value": "document"
    },
    "size": {
      "value": 412000
    }
  },
  "version": 1,
  "created_at": "2026-09-26T09:00:00Z",
  "updated_at": "2026-09-26T09:00:00Z",
  "published_at": "2026-09-26T09:00:00Z"
}
