{
  "id": "post-accessibility-without-pain-five-rules-for-forms",
  "kind": "post",
  "status": "published",
  "visibility": "public",
  "slug": {
    "en": "accessibility-without-pain-five-rules-for-forms"
  },
  "title": {
    "en": "Accessibility without pain: five rules for forms"
  },
  "content": {
    "en": "This is demo text. The main material goes here: paragraphs, lists and notes. You can edit it in the editor, and saving happens in the browser.\n\nThe second paragraph continues the thought and shows how a long text looks in the preview."
  },
  "excerpt": {
    "en": "In short: accessibility without pain: five rules for forms."
  },
  "author_id": "user-alexey-kovalev",
  "terms": [
    {
      "taxonomy": "category",
      "term_id": "term-category-guides"
    },
    {
      "taxonomy": "tag",
      "term_id": "term-tag-a11y"
    },
    {
      "taxonomy": "tag",
      "term_id": "term-tag-markup"
    }
  ],
  "version": 1,
  "created_at": "2026-09-23T09:00:00Z",
  "updated_at": "2026-09-25T09:00:00Z",
  "published_at": "2026-09-25T09:00:00Z"
}
