{
  "id": "page-careers",
  "kind": "page",
  "status": "draft",
  "visibility": "public",
  "slug": {
    "en": "careers"
  },
  "title": {
    "en": "Careers"
  },
  "content": {
    "en": "This is demo text. The main material goes here: paragraphs, lists and notes. You can edit it in the editor, and saving happens in the browser.\n\nThe second paragraph continues the thought and shows how a long text looks in the preview."
  },
  "excerpt": {
    "en": "In short: careers."
  },
  "author_id": "user-maria-sokolova",
  "version": 1,
  "created_at": "2026-09-28T03:00:00Z",
  "updated_at": "2026-09-30T03:00:00Z"
}
