{
  "id": "comment-maria",
  "kind": "comment",
  "status": "published",
  "visibility": "public",
  "slug": {
    "en": "comment-maria"
  },
  "title": {
    "en": "Maria"
  },
  "content": {
    "en": "Agreed, speed matters more than a pretty font."
  },
  "metadata": {
    "author_name": {
      "value": "Maria"
    },
    "author_email": {
      "value": "maria2@mail.example"
    },
    "moderation": {
      "value": "approved"
    },
    "comment_post": {
      "value": "post-why-we-dropped-third-party-fonts"
    }
  },
  "version": 1,
  "created_at": "2026-09-28T09:00:00Z",
  "updated_at": "2026-09-28T09:00:00Z",
  "published_at": "2026-09-28T09:00:00Z"
}
